{
  "id": "c950-data-structures-and-algorithms-ii",
  "name": "C950 - Data Structures and Algorithms II",
  "full_name": "Data Structures and Algorithms II",
  "category": "Computer Science",
  "course_codes": [
    "C950"
  ],
  "url": "https://wguconnect.wgu.edu/hub/wgu-connect/groups/c950-data-structures-and-algorithms-ii",
  "discussions_url": "https://wguconnect.wgu.edu/hub/wgu-connect/groups/c950-data-structures-and-algorithms-ii/discussions",
  "resources_url": "https://wguconnect.wgu.edu/hub/wgu-connect/groups/c950-data-structures-and-algorithms-ii/resources",
  "verified": true
}