{
  "id": "d480-software-design-and-quality-assurance",
  "name": "D480 - Software Design and Quality Assurance",
  "full_name": "Software Design and Quality Assurance",
  "category": "Computer Science",
  "course_codes": [
    "D480"
  ],
  "url": "https://wguconnect.wgu.edu/hub/wgu-connect/groups/d480-software-design-and-quality-assurance",
  "discussions_url": "https://wguconnect.wgu.edu/hub/wgu-connect/groups/d480-software-design-and-quality-assurance/discussions",
  "resources_url": "https://wguconnect.wgu.edu/hub/wgu-connect/groups/d480-software-design-and-quality-assurance/resources",
  "verified": true
}